{
  "$schema": "./context-index.schema.json",
  "schemaVersion": 1,
  "project": {
    "name": "winwork-sales-demo",
    "kind": "protected-sales-presentations-plus-public-court-presentation",
    "runtime": "Vercel Edge Routing Middleware + React 19 + TypeScript + Vite + React Router + Tailwind CSS + Motion",
    "packageManager": "pnpm@11",
    "node": ">=24 <25",
    "entrypoints": [
      "AGENTS.md",
      "middleware.ts",
      "src/main.tsx",
      "src/court/main.tsx",
      "src/app/router.tsx",
      "src/presentation/engine/Presentation.tsx"
    ]
  },
  "sourcePriority": [
    {
      "rank": 1,
      "status": "authoritative",
      "paths": [
        "src",
        "public/enterprise-slides",
        "public/api-slides",
        "public/small-slides",
        "public/court-slides",
        "public/court-assets",
        "public/performer-registration-flow",
        "public/winwork-logo.svg",
        "public/favicon.svg",
        "middleware.ts",
        "auth",
        "api/auth/login.ts",
        ".env.example",
        "package.json",
        "pnpm-lock.yaml",
        ".node-version",
        ".github/workflows/ci.yml",
        "vite.config.ts",
        "vite.court.config.ts",
        "court.html",
        "tsconfig.json",
        "tsconfig.app.json",
        "tsconfig.node.json",
        "eslint.config.js",
        "prettier.config.mjs",
        "vercel.json"
      ]
    },
    {
      "rank": 2,
      "status": "current",
      "paths": ["AGENTS.md", "README.md", "docs"]
    },
    {
      "rank": 3,
      "status": "reference",
      "paths": ["pencil", "design-qa.md"]
    },
    {
      "rank": 4,
      "status": "historical",
      "paths": ["base_documentation"]
    }
  ],
  "commands": {
    "install": "pnpm install --frozen-lockfile",
    "develop": "pnpm dev",
    "authCheck": "pnpm auth:check",
    "docsCheck": "pnpm docs:check",
    "formatCheck": "pnpm format:check",
    "lint": "pnpm lint",
    "typecheck": "pnpm typecheck",
    "build": "pnpm build",
    "fullGate": "pnpm check"
  },
  "routes": [
    {
      "path": "/enterprise",
      "trackId": "enterprise",
      "status": "implemented",
      "firstSceneId": "ent-01",
      "configPath": "src/presentation/config/enterprise.ts"
    },
    {
      "path": "/api",
      "trackId": "api",
      "status": "implemented",
      "firstSceneId": "api-01",
      "configPath": "src/presentation/config/api.ts"
    },
    {
      "path": "/small",
      "trackId": "small",
      "status": "implemented",
      "firstSceneId": "smb-01",
      "configPath": "src/presentation/config/small.ts"
    },
    {
      "path": "/court",
      "trackId": "court",
      "status": "implemented",
      "firstSceneId": "court-01",
      "configPath": "src/presentation/config/court.ts"
    }
  ],
  "invariants": [
    {
      "id": "static-demo-only",
      "rule": "The shared-password access gateway is the only server-side behavior; there is no account system, product backend, database, analytics, production API, or real personal/customer data."
    },
    {
      "id": "access-gateway",
      "rule": "Vercel requests fail closed before cache; server-only secrets sign 30-day sessions for the sales SPA and assets. Only /court, its isolated bundle/slides/assets, and the exact shared WinWork wordmark are public for GET/HEAD."
    },
    {
      "id": "shared-engine",
      "rule": "All tracks use the shared presentation engine and data-defined configs. Protected tracks use the main router; the public court track uses an isolated Vite entry so the protected SPA bundle remains private."
    },
    {
      "id": "url-scene-state",
      "rule": "The scene query parameter is the active-scene source of truth; stable IDs, unrelated query parameters, and browser history are preserved."
    },
    {
      "id": "resettable-local-state",
      "rule": "Presentation and flow reset remount local UI; demo state is deterministic and cannot leak between scenes or openings."
    },
    {
      "id": "semantic-demo-ui",
      "rule": "Interactive product demos use semantic React controls. The explicitly approved performer-registration flow is a temporary screenshot-only viewer with navigation and scrolling, while public/demo-flows PNG files remain QA references only."
    },
    {
      "id": "keyboard-and-focus",
      "rule": "Editable controls and open dialogs are isolated from presentation shortcuts; focus trap/restore, Escape close, focus visibility, and reduced motion are preserved."
    },
    {
      "id": "approved-content",
      "rule": "Do not invent WinWork design or sales claims; use approved Pencil/design inputs and synthetic demo content."
    },
    {
      "id": "asset-separation",
      "rule": "Runtime exports live under public; editable Pencil sources and ephemeral QA evidence are never runtime dependencies."
    }
  ],
  "assets": {
    "runtimePaths": [
      "public/enterprise-slides",
      "public/api-slides",
      "public/small-slides",
      "public/court-slides",
      "public/court-assets",
      "public/performer-registration-flow",
      "public/winwork-logo.svg",
      "public/favicon.svg"
    ],
    "referencePaths": ["public/demo-flows", "pencil", "design-qa.md"],
    "historicalPaths": ["base_documentation"]
  },
  "taskAreas": [
    {
      "id": "orientation-and-scope",
      "intent": "Understand repository purpose, current readiness, boundaries, and source precedence.",
      "triggers": [
        "orientation",
        "scope",
        "repository overview",
        "what is implemented"
      ],
      "readFirst": ["AGENTS.md", "README.md", "docs/architecture.md"],
      "changeWith": ["docs/agents/context-index.json"],
      "invariantIds": [
        "static-demo-only",
        "access-gateway",
        "approved-content"
      ],
      "verification": ["pnpm docs:check"]
    },
    {
      "id": "access-gateway",
      "intent": "Change the shared sales password, signed session, login/logout response, protected-path coverage, or Vercel secret contract.",
      "triggers": [
        "password",
        "authorization",
        "authentication",
        "login",
        "logout",
        "session",
        "cookie",
        "environment secret",
        "access gateway"
      ],
      "readFirst": [
        "middleware.ts",
        "api/auth/login.ts",
        "auth/session.ts",
        ".env.example",
        "vercel.json"
      ],
      "changeWith": [
        "scripts/check-auth.mjs",
        "src/app/TrackSelector.tsx",
        "src/styles/globals.css",
        "package.json",
        "pnpm-lock.yaml",
        "tsconfig.json",
        "tsconfig.node.json",
        "README.md",
        "docs/architecture.md",
        "docs/agents/file-map.md",
        "docs/agents/change-playbooks.md"
      ],
      "invariantIds": ["static-demo-only", "access-gateway"],
      "verification": [
        "pnpm auth:check",
        "pnpm check",
        "Use vercel dev to verify missing configuration, wrong and correct password, preserved deep links, direct protected assets, tampered and expired cookies, 30-day persistence, password rotation, and logout."
      ]
    },
    {
      "id": "routes-and-track-selector",
      "intent": "Add or change a public presentation route, landing card, track readiness label, or not-found behavior.",
      "triggers": [
        "route",
        "track",
        "landing",
        "selector",
        "not found",
        "fullscreen entry"
      ],
      "readFirst": [
        "src/app/router.tsx",
        "src/app/TrackSelector.tsx",
        "src/presentation/engine/types.ts",
        "middleware.ts",
        "vercel.json"
      ],
      "changeWith": [
        "src/presentation/config",
        "src/court/main.tsx",
        "court.html",
        "vite.court.config.ts",
        "scripts/check-auth.mjs",
        "vercel.json",
        "README.md",
        "docs/agents/context-index.json"
      ],
      "invariantIds": ["shared-engine", "url-scene-state", "approved-content"],
      "verification": [
        "pnpm check",
        "Verify /enterprise, /api, /small, /court, direct refresh, and the changed route in a browser; when access differs, prove the main bundle remains protected."
      ]
    },
    {
      "id": "presentation-runtime",
      "intent": "Change scene navigation, URL normalization, browser history, reset, transitions, controls, shortcuts, or fullscreen.",
      "triggers": [
        "navigation",
        "scene query",
        "history",
        "reset",
        "keyboard",
        "fullscreen",
        "transition"
      ],
      "readFirst": [
        "src/presentation/engine/Presentation.tsx",
        "src/presentation/engine/PresentationControls.tsx",
        "src/presentation/engine/SceneRenderer.tsx",
        "src/presentation/engine/types.ts"
      ],
      "changeWith": [
        "src/styles/globals.css",
        "src/presentation/scenes",
        "docs/architecture.md"
      ],
      "invariantIds": [
        "shared-engine",
        "url-scene-state",
        "resettable-local-state",
        "keyboard-and-focus"
      ],
      "verification": [
        "pnpm check",
        "Verify all tracks, valid and invalid scene IDs, Back/Forward, ArrowLeft/ArrowRight, F, reset, and modal keyboard isolation."
      ]
    },
    {
      "id": "exported-track-slides",
      "intent": "Change Enterprise, API / Embedded, Small Business, or Court scene order, titles, HTML exports, Pencil metadata, or adjacent runtime images.",
      "triggers": [
        "enterprise slide",
        "api slide",
        "small business slide",
        "court slide",
        "Pencil export",
        "frameId",
        "ent-NN",
        "api-NN",
        "smb-NN",
        "court-NN",
        "slide copy",
        "slide image"
      ],
      "readFirst": [
        "src/presentation/config/enterprise.ts",
        "src/presentation/config/api.ts",
        "src/presentation/config/small.ts",